,Job_Category,Job_Title,Company_Name,Location,Summary,Date,URL
102,Data Scientist,Junior Data Scientist,Hutchison Travel Limited (hutchgo.com),"Hung Hom, Kowloon","Passionate about new technologies and data analysis. Build reports and visualizations to present data, generate insights from disparate sources of data,...",30+ days ago,https://www.indeed.hk/rc/clk?jk=68468f841bbf0da8&fccid=c604b374adac7e5f&vjs=3
103,Data Scientist,Data Scientist - Gaming company,Hays,Hong Kong,"Data Scientist – 35k to 55k – New Role. 3+ years experience in ETL, data warehouse and data analytics. Big data technology skills in Hadoop and Spark....",30+ days ago,https://www.indeed.hk/rc/clk?jk=e6c4e3a623aec9a4&fccid=31670bef3ae6497b&vjs=3
104,Data Scientist,Data Scientist + Product role - 45k to 55k,Hays,Hong Kong,"3+ years experience in ETL, data warehouse and data analytics. Big data technology skills in Hadoop and Spark. Working on large streaming data sets to help with...",30+ days ago,https://www.indeed.hk/rc/clk?jk=741144267b7d0aeb&fccid=31670bef3ae6497b&vjs=3
105,Data Scientist,Data Scientist,Cigna,"Wan Chai, Hong Kong Island","We are looking for a full stack data scientist to join the innovation and insights team. Build reports and visualizations to present data, generate actionable...",30+ days ago,https://www.indeed.hk/rc/clk?jk=7aacb2221f980565&fccid=afbf8c270610a38a&vjs=3
106,Data Scientist,Data Scientist - 55k to 60k - Retail Bank,Hays,Hong Kong,"6+ years experience working in progressive Data related roles with duties focused in analytics, data science or big data....",30+ days ago,https://www.indeed.hk/rc/clk?jk=9218e662d3c071dd&fccid=31670bef3ae6497b&vjs=3
107,Data Scientist,Data Scientist,Conners Recruitment,Hong Kong,"Responsible for the design & implementation of big data analytics projects. Uncover patterns by integrating, exploring and mining structured and unstructured...",30+ days ago,https://www.indeed.hk/rc/clk?jk=7058f4fee559761a&fccid=5f9b20609e6ef115&vjs=3
114,Data Scientist,Data Scientist - Hedge Fund (Alpha Seeking Experience Required),Michael Page,Hong Kong,"Specialisation:IT Data Analysis. Propose, build, and execute various data science models to leverage existing data to improve business....",30+ days ago,https://www.indeed.hk/rc/clk?jk=416029054f71e7dc&fccid=77087bd1709a8148&vjs=3
115,Data Scientist,Data Scientist - Global Insurance,Hays,Hong Kong,"Strong knowledge of data analytics, data visualization, and statistical modelling. The organisation is currently experiencing tremendous growth and is seeking...",30+ days ago,https://www.indeed.hk/rc/clk?jk=eb036da862af190f&fccid=31670bef3ae6497b&vjs=3
116,Data Scientist,Data Scientist - Insurance Industry,Hays,Hong Kong,Is a general and life insurance company who has created a new Data Scientist position. More than 4 years experience in progressive analytics / data science...,30+ days ago,https://www.indeed.hk/rc/clk?jk=9b3cc76c8d77bc35&fccid=31670bef3ae6497b&vjs=3
117,Data Scientist,Data Scientist - new technology,Hays,Hong Kong,They are looking for a Data Scientist to collaborate with business users and IT to ideate and introduce new data science innovations into business areas....,30+ days ago,https://www.indeed.hk/rc/clk?jk=cd2f84f1ef12455a&fccid=31670bef3ae6497b&vjs=3
118,Data Scientist,Senior Data Scientist,Hays,Hong Kong,Managing a team of Data Scientists. Deep technical experience and understanding but also a great ability to convey the data and tell a story with the data work...,30+ days ago,https://www.indeed.hk/rc/clk?jk=1036497680cf41c4&fccid=31670bef3ae6497b&vjs=3
119,Data Scientist,Data Scientist,Harbridge Partners Limited,Hong Kong,Work with data in a newly built data lake and use skills and experience in the areas to architect and build out the product....,30+ days ago,https://www.indeed.hk/company/Harbridge-Partners-Limited/jobs/Data-Scientist-597da94283824a2c?fccid=7172656bce592de0&vjs=3
120,Data Scientist,Product Analytics / Data Scientist,Crypto.com,Hong Kong Island,"Big Data, Blockchain. Lead the data strategy of product engineering, influencing them to make well-informed architecture and design decisions that affect data....",30+ days ago,https://www.indeed.hk/rc/clk?jk=dfe701326a127bbc&fccid=18bfd14af40ab66a&vjs=3
121,Data Scientist,Data Engineer/ Scientist - Data Modelling,Michael Page,Kowloon,"You will be required to develop data models, and perform data cleaning, data audit and mass/ raw data analytic duties throughout the life-cycle....",30+ days ago,https://www.indeed.hk/rc/clk?jk=ed09022684ce4b82&fccid=77087bd1709a8148&vjs=3
123,Data Scientist,Senior insights Manager,Oddup,Hong Kong,"You will work closely with other members of the Data Insights team, including our data scientist and data analysts....",30+ days ago,https://www.indeed.hk/rc/clk?jk=582eb7245f8e2a90&fccid=5577542ad5a2b685&vjs=3
